{
  "schema_version": "0.1.0",
  "receipt_id": "receipt-river-xunit-001",
  "recorded_at": "2026-08-23T14:50:00+09:00",
  "kind": "cross_unit_evidence",
  "payload": {
    "kind": "cross_unit_evidence",
    "evidence_id": "xunit-160e4dfc877ffc0b",
    "framework": "community-program-routing",
    "local_unit": "river-town-b",
    "source_unit": "coastal-town-a",
    "protocol_ref": "community-evening-market@v2",
    "lineage": {
      "source_receipt_refs": [
        "receipt-coastal-017",
        "receipt-coastal-023"
      ],
      "parent_protocol_refs": [
        "community-evening-market@v1"
      ],
      "source_git_commit": "8e7a1d3f4a6b2c19",
      "source_git_tag": "v2.0.0",
      "source_repository": "example/coastal-community-protocols"
    },
    "source_context": {
      "population_band": "small-city",
      "venue": "harbor-plaza",
      "operating_window": "18:00-21:00",
      "last_transit": "21:30",
      "cleanup_staff": 18
    },
    "local_context": {
      "population_band": "small-city",
      "venue": "station-plaza",
      "operating_window": "18:00-21:00",
      "last_transit": "22:10",
      "cleanup_staff": 11
    },
    "context_binding": {
      "similarity": 0.67,
      "local_unknowns": [
        "cleanup-capacity-at-peak",
        "rain-season-attendance"
      ]
    },
    "source_outcome": {
      "decision_was": "correct",
      "what_happened": "The source unit completed twelve weekly runs without exceeding its cleanup capacity.",
      "decision": {
        "state": "EXECUTE",
        "target": "community-evening-market@v2"
      }
    },
    "transferability": {
      "status": "remote_only",
      "local_verdict": "PILOT",
      "local_outcome_ref": null,
      "updates_local_rii": false
    }
  },
  "integrity": {
  "prev_hash": "genesis",
  "content_sha256": "82bf224627f9345fb0fc058acabe19fe0b4d4f7b918318634750edff4f7bdd9b",
  "record_sha256": "1ce98e46f1e9c8ac68653e513b1449829ed0cc98683d4be9502eec0373b8aa7d"
}
}
